[
  {
    "product_id": "P01",
    "title": "Beehive releases",
    "publisher": "New Zealand Government / Beehive",
    "domain": "Government statements",
    "source_url": "https://www.beehive.govt.nz/releases",
    "snapshot_at_utc": "2026-09-19T19:12:17.178902Z",
    "record_count": 4735,
    "evidence_forms": [
      {
        "type": "source body / document record",
        "count": 4735
      }
    ],
    "observed_start_utc": "2026-09-19T09:26:42.000Z",
    "observed_end_utc": "2026-09-19T16:17:15.000Z",
    "coverage_window": "Releases dated 2023-11-29 through snapshot date",
    "release_mode": "metadata-and-links-only",
    "rights_status": "pending-publisher-review",
    "known_limitations": "Link only; copied release bodies excluded pending source-specific review"
  },
  {
    "product_id": "P02",
    "title": "54th Parliament bill publications",
    "publisher": "New Zealand Parliament",
    "domain": "Parliament and law",
    "source_url": "https://www.parliament.nz/en/pb/bills-and-laws/bills-proposed-laws/",
    "snapshot_at_utc": "2026-09-19T19:12:17.178902Z",
    "record_count": 201,
    "evidence_forms": [
      {
        "type": "source body / document record",
        "count": 115
      },
      {
        "type": "catalogue",
        "count": 86
      }
    ],
    "observed_start_utc": "2026-09-19T18:31:20.033Z",
    "observed_end_utc": "2026-09-19T18:31:20.033Z",
    "coverage_window": "See limitation; observation timestamps are not necessarily reference periods",
    "release_mode": "metadata-and-links-only",
    "rights_status": "pending-publisher-review",
    "known_limitations": "Four known retrieval gaps; proposed bill text is not enacted law"
  },
  {
    "product_id": "P03",
    "title": "Current bills index",
    "publisher": "New Zealand Parliament",
    "domain": "Parliament and law",
    "source_url": "https://www.parliament.nz/en/pb/bills-and-laws/bills-proposed-laws/",
    "snapshot_at_utc": "2026-09-19T19:12:17.178902Z",
    "record_count": 101,
    "evidence_forms": [
      {
        "type": "normalised fact",
        "count": 101
      }
    ],
    "observed_start_utc": "2026-09-16T03:16:18.536Z",
    "observed_end_utc": "2026-09-19T01:21:42.353Z",
    "coverage_window": "See limitation; observation timestamps are not necessarily reference periods",
    "release_mode": "metadata-and-links-only",
    "rights_status": "pending-publisher-review",
    "known_limitations": "Current snapshot; not all historical legislation"
  },
  {
    "product_id": "P04",
    "title": "2023 general election candidate roster",
    "publisher": "Electoral Commission",
    "domain": "Elections",
    "source_url": "https://elections.nz/democracy-in-nz/historical-events/2023-general-election/",
    "snapshot_at_utc": "2026-09-19T19:12:17.178902Z",
    "record_count": 486,
    "evidence_forms": [
      {
        "type": "normalised fact",
        "count": 486
      }
    ],
    "observed_start_utc": "2026-09-19T01:09:19.454Z",
    "observed_end_utc": "2026-09-19T01:09:19.454Z",
    "coverage_window": "2023 general election",
    "release_mode": "metadata-and-links-only",
    "rights_status": "pending-publisher-review",
    "known_limitations": "2023 only; do not infer 2026 candidate publication"
  },
  {
    "product_id": "P05",
    "title": "54th Parliament committee business",
    "publisher": "New Zealand Parliament",
    "domain": "Parliament and law",
    "source_url": "https://www.parliament.nz/en/pb/sc/",
    "snapshot_at_utc": "2026-09-19T19:12:17.178902Z",
    "record_count": 123,
    "evidence_forms": [
      {
        "type": "normalised fact",
        "count": 123
      }
    ],
    "observed_start_utc": "2026-09-19T01:09:20.010Z",
    "observed_end_utc": "2026-09-19T01:09:23.906Z",
    "coverage_window": "See limitation; observation timestamps are not necessarily reference periods",
    "release_mode": "metadata-and-links-only",
    "rights_status": "pending-publisher-review",
    "known_limitations": "Current selected product; broader committee activity not enumerated"
  },
  {
    "product_id": "P06",
    "title": "54th Parliament select committee report bodies",
    "publisher": "New Zealand Parliament",
    "domain": "Parliament and law",
    "source_url": "https://www.parliament.nz/en/pb/sc/reports/",
    "snapshot_at_utc": "2026-09-19T19:12:17.178902Z",
    "record_count": 1285,
    "evidence_forms": [
      {
        "type": "source body / document record",
        "count": 1285
      }
    ],
    "observed_start_utc": "2026-09-19T09:08:40.507Z",
    "observed_end_utc": "2026-09-19T11:50:31.743Z",
    "coverage_window": "See limitation; observation timestamps are not necessarily reference periods",
    "release_mode": "metadata-and-links-only",
    "rights_status": "pending-publisher-review",
    "known_limitations": "Copied report bodies excluded from this repository pending rights review"
  },
  {
    "product_id": "P07",
    "title": "54th Parliament select committee report index",
    "publisher": "New Zealand Parliament",
    "domain": "Parliament and law",
    "source_url": "https://www.parliament.nz/en/pb/sc/reports/",
    "snapshot_at_utc": "2026-09-19T19:12:17.178902Z",
    "record_count": 1286,
    "evidence_forms": [
      {
        "type": "normalised fact",
        "count": 1286
      }
    ],
    "observed_start_utc": "2026-09-19T01:52:39.009Z",
    "observed_end_utc": "2026-09-19T01:53:49.820Z",
    "coverage_window": "See limitation; observation timestamps are not necessarily reference periods",
    "release_mode": "metadata-and-links-only",
    "rights_status": "pending-publisher-review",
    "known_limitations": "Current selected report index; not all committee materials"
  },
  {
    "product_id": "P08",
    "title": "2023 overall election results",
    "publisher": "Electoral Commission",
    "domain": "Elections",
    "source_url": "https://electionresults.govt.nz/electionresults_2023/",
    "snapshot_at_utc": "2026-09-19T19:12:17.178902Z",
    "record_count": 18,
    "evidence_forms": [
      {
        "type": "normalised fact",
        "count": 17
      },
      {
        "type": "aggregate",
        "count": 1
      }
    ],
    "observed_start_utc": "2026-09-19T09:22:27.000Z",
    "observed_end_utc": "2026-09-19T09:22:27.000Z",
    "coverage_window": "2023 general election",
    "release_mode": "metadata-and-links-only",
    "rights_status": "pending-publisher-review",
    "known_limitations": "2023 general election only"
  },
  {
    "product_id": "P09",
    "title": "2023 electorate election results",
    "publisher": "Electoral Commission",
    "domain": "Elections",
    "source_url": "https://electionresults.govt.nz/electionresults_2023/",
    "snapshot_at_utc": "2026-09-19T19:12:17.178902Z",
    "record_count": 1791,
    "evidence_forms": [
      {
        "type": "aggregate",
        "count": 72
      },
      {
        "type": "normalised fact",
        "count": 1719
      }
    ],
    "observed_start_utc": "2026-09-19T09:44:19.000Z",
    "observed_end_utc": "2026-09-19T09:46:49.000Z",
    "coverage_window": "2023 general election",
    "release_mode": "metadata-and-links-only",
    "rights_status": "pending-publisher-review",
    "known_limitations": "2023 general election only; geography/version alignment required"
  },
  {
    "product_id": "P10",
    "title": "Current members of Parliament",
    "publisher": "New Zealand Parliament",
    "domain": "Parliament and law",
    "source_url": "https://www3.parliament.nz/en/mps-and-electorates/members-of-parliament",
    "snapshot_at_utc": "2026-09-19T19:12:17.178902Z",
    "record_count": 122,
    "evidence_forms": [
      {
        "type": "normalised fact",
        "count": 122
      }
    ],
    "observed_start_utc": "2026-09-19T01:17:34.224Z",
    "observed_end_utc": "2026-09-19T01:17:34.224Z",
    "coverage_window": "See limitation; observation timestamps are not necessarily reference periods",
    "release_mode": "metadata-and-links-only",
    "rights_status": "pending-publisher-review",
    "known_limitations": "Current snapshot; membership changes over time"
  },
  {
    "product_id": "P11",
    "title": "Health New Zealand data catalogue sample",
    "publisher": "Health New Zealand",
    "domain": "Social outcomes",
    "source_url": "https://www.tewhatuora.govt.nz/for-health-professionals/data-and-statistics/",
    "snapshot_at_utc": "2026-09-19T19:12:17.178902Z",
    "record_count": 93,
    "evidence_forms": [
      {
        "type": "normalised fact",
        "count": 44
      },
      {
        "type": "catalogue",
        "count": 26
      },
      {
        "type": "catalogue metadata",
        "count": 23
      }
    ],
    "observed_start_utc": "2026-09-15T19:03:59.219Z",
    "observed_end_utc": "2026-09-16T03:36:15.650Z",
    "coverage_window": "See limitation; observation timestamps are not necessarily reference periods",
    "release_mode": "metadata-and-links-only",
    "rights_status": "pending-publisher-review",
    "known_limitations": "Mixed facts and catalogue metadata; incomplete denominator"
  },
  {
    "product_id": "P12",
    "title": "MSD benefits and hardship statistics sample",
    "publisher": "Ministry of Social Development",
    "domain": "Social outcomes",
    "source_url": "https://www.msd.govt.nz/about-msd-and-our-work/publications-resources/statistics/",
    "snapshot_at_utc": "2026-09-19T19:12:17.178902Z",
    "record_count": 929,
    "evidence_forms": [
      {
        "type": "catalogue",
        "count": 26
      },
      {
        "type": "normalised fact",
        "count": 903
      }
    ],
    "observed_start_utc": "2026-09-15T19:03:55.040Z",
    "observed_end_utc": "2026-09-16T03:16:38.542Z",
    "coverage_window": "See limitation; observation timestamps are not necessarily reference periods",
    "release_mode": "metadata-and-links-only",
    "rights_status": "pending-publisher-review",